Talent Name,Type Name,Description
Favonius Bladework - Weiss,Normal Attack,"Normal Attack: Perform up to 5 rapid strikes.Charged Attack: Consumes a certain amount of Stamina to unleash 2 rapid sword strikes.Plunging Attack: Plunges from mid-air to strike the ground below, damaging opponents along the path and dealing AoE DMG upon impact."
Abiogenesis: Solar Isotoma,Elemental Skill,"Albedo creates a Solar Isotoma using alchemy, which deals AoE Geo DMG on appearance.Solar Isotoma has the following properties:When enemies within the Solar Isotoma zone take damage, the Solar Isotoma will generate Transient Blossoms which deal AoE Geo DMG. DMG dealt scales off Albedo's DEF. Transient Blossoms can only be generated once every 2s.When a character is located at the locus of the Solar Isotoma, the Solar Isotoma will accumulate Geo power to form a crystallized platform that lifts the character up to a certain height. Only one crystallized platform can exist at a time.Solar Isotoma is a Geo Construct.Hold to designate the location of the skill."
Rite of Progeniture: Tectonic Tide,Elemental Burst,"Under Albedo's command, Geo crystals surge and burst forth, dealing AoE Geo DMG in front of him.If a Solar Isotoma created by Albedo himself is on the field, 7 Fatal Blossoms will be generated in the Solar Isotoma field, bursting violently into bloom and dealing AoE Geo DMG.Tecotonic Tide DMG and Fatal Blossom DMG will not generate Transient Blossoms."
Calcite Might,1st Ascension Passive,Transient Blossoms generated by Abiogenesis: Solar Isotoma deal 25% more DMG to opponents whose HP is below 50%.
Homuncular Nature,4th Ascension Passive,Using Rite of Progeniture: Tectonic Tide increases the Elemental Mastery of nearby party members by 125 for 10s.
Flash of Genius (Albedo),Utility Passive,"When Albedo crafts Weapon Ascension Materials, he has a 10% chance to receive double the product."
