Level,Name,Effect
1,Ice Unleashed,The last attack of Chongyun's Normal Attack combo releases 3 ice blades. Each blade deals 50% of Chongyun's ATK as Cryo DMG to all opponents in its path.
2,Atmospheric Revolution,Elemental Skills and Elemental Bursts cast within the Frost Field created by Spirit Blade: Chonghua's Layered Frost have their CD time decreased by 15%.
3,Cloudburst,Increases the Level of Spirit Blade: Cloud-Parting Star by 3.Maximum upgrade level is 15.
4,Frozen Skies,Chongyun regenerates 1 Energy every time he hits an opponent affected by Cryo.This effect can only occur once every 2s.
5,The True Path,Increases the Level of Spirit Blade: Chonghua's Layered Frost by 3.Maximum upgrade level is 15.
6,Rally of Four Blades,Spirit Blade: Cloud-Parting Star deals 15% more DMG to opponents with a lower percentage of their Max HP remaining than Chongyun.This skill will also summon 1 additional spirit blade.
