Talent Name,Type Name,Description
Kätzlein Style,Normal Attack,"Normal Attack: Perform up to 5 consecutive shots with a bow.Charged Attack: Perform a more precise Aimed Shot with increased DMG. While aiming, biting frost will accumulate on the arrowhead. A fully charged frost arrow will deal Cryo Damage.Plunging Attack: Fires off a shower of arrows in mid-air before falling and striking the ground, dealing AoE DMG on impact."
Icy Paws,Elemental Skill,"Fires an Icy Paw that deals Cryo DMG to opponents and forms a shield on hit. The shield's DMG Absorption scales based on Diona's Max HP, and its duration scales off the number of Icy Paws that hit their target.Press: Rapidly fires off 2 Icy Paws.Hold: Dashes back quickly before firing 5 Icy Paws. The shield created by a Hold attack will gain a 75% DMG Absorption Bonus.The shield has a 250% Cryo DMG Absorption Bonus, and will infuse Diona with Cryo at the point of formation for a short duration."
Signature Mix,Elemental Burst,"Tosses out a special cold brew that deals AoE Cryo DMG and creates a Drunken Mist in an AoE.Every 2 seconds, for 12 seconds, Drunken Mist:Deals Cryo DMG to opponents within the field.Regenerates the HP of characters within the field."
Cat's Tail Secret Menu,1st Ascension Passive,Characters shielded by Icy Paws have their Movement SPD increased by 10% and their Stamina Consumption decreased by 10%.
Drunkards' Farce,4th Ascension Passive,Opponents who enter the AoE of Signature Mix have 10% decreased ATK for 15s.
Complimentary Bar Food,Utility Passive,"When a Perfect Cooking is achieved on a dish with restorative effects, Diona has a 12% chance to obtain double the product."
