Talent Name,Type Name,Description
Bolts of Downfall,Normal Attack,"Normal Attack: Perform up to 5 consecutive shots with a bow.Charged Attack: Perform a more precise Aimed Shot with increased DMG. While aiming, the dark lightning spirits of Immernachtreich shall heed the call of their Prinzessin and indwell the enchanted arrowhead. When fully indwelt, the Rachsüchtig Blitz shall deal immense Electro DMG.Plunging Attack: Fires off a shower of arrows in mid-air before falling and striking the ground, dealing AoE DMG upon impact."
Nightrider,Elemental Skill,"Summons Oz. The night raven forged of darkness and lightning descends upon the land, dealing Electro DMG in a small AoE.For the ability's duration, Oz will continuously attack nearby opponents with Freikugel.Hold to adjust the location Oz will be summoned to.Press again any time during the ability's duration to once again summon him to Fischl's side."
Midnight Phantasmagoria,Elemental Burst,"Summons Oz to spread his twin wings of twilight and defend Fischl. Has the following properties during the ability's duration:Fischl takes on Oz's form, greatly increasing her Movement Speed.Strikes nearby opponents with lightning, dealing Electro DMG to opponents she comes in contact with. Each opponent can only be struck once.Once this ability's effects end, Oz will remain on the battlefield and attack his Prinzessin's foes. If Oz is already on the field, then this will reset the duration of his presence."
Stellar Predator,1st Ascension Passive,"When Fischl hits Oz with a fully-charged Aimed Shot, Oz brings down Thundering Retribution, dealing AoE Electro DMG equal to 152.7% of the arrow's DMG."
Undone Be Thy Sinful Hex,4th Ascension Passive,"If your active character triggers an Electro-related Elemental Reaction when Oz is on the field, the opponent shall be stricken with Thundering Retribution, dealing Electro DMG equal to 80% of Fischl's ATK."
Mein Hausgarten,Utility Passive,"When dispatched on an expedition in Mondstadt, time consumed is reduced by 25%."
