Level,Name,Effect
1,Prophecy of Submersion,"When any of your own party members hits an opponent affected by an Omen, the effects of Hydro-related Elemental Reactions are enhanced for 8s:Electro-Charged DMG increases by 15%.Vaporize DMG increases by 15%.Hydro Swirl DMG increases by 15%.Frozen duration is extended by 15%."
2,Lunar Chain,"When a Normal Attack hits, there is a 20% chance that it will be automatically followed by a Charged Attack.This effect can only occur once every 5s."
3,Restless Revolution,Increases the Level of Stellaris Phantasm by 3.Maximum upgrade level is 15.
4,Prophecy of Oblivion,"When any party member attacks an opponent affected by an Omen, their CRIT Rate is increased by 15%."
5,Mockery of Fortuna,Increases the Level of Mirror Reflection of Doom by 3.Maximum upgrade level is 15.
6,Rhetorics of Calamitas,"Upon entering Illusory Torrent, Mona gains a 60% increase to the DMG of her next Charged Attack per second of movement.A maximum DMG Bonus of 180% can be achieved in this manner. The effect lasts for no more than 8s."
