Talent Name,Type Name,Description
Seal of Approval,Normal Attack,"Normal Attack: Shoots fireballs that deal up to three counts of Pyro DMG. When Yanfei's Normal Attacks hit enemies, they will grant her a single Scarlet Seal. Yanfei may possess a maximum of 3 Scarlet Seals, and each time this effect is triggered, the duration of currently possessed Scarlet Seals will refresh. Each Scarlet Seal will decrease Yanfei's Stamina consumption and will disappear when she leaves the field.Charged Attack: Consumes Stamina and all Scarlet Seals before dealing AoE Pyro DMG to the opponents after a short casting time. This Charged Attack's AoE and DMG will increase according to the amount of Scarlet Seals consumed.Plunging Attack: Gathering the power of Pyro, Yanfei plunges towards the ground from mid-air, damaging all opponents in her path. Deals AoE Pyro DMG upon impact with the ground."
Signed Edict,Elemental Skill,"Summons blistering flames that deal AoE Pyro DMG.If this attack hits an enemy, Yanfei is granted the maximum number of Scarlet Seals."
Done Deal,Elemental Burst,"Triggers a spray of intense flames that rush at nearby opponents, dealing AoE Pyro DMG, granting Yanfei the maximum number of Scarlet Seals, and applying Brilliance to her.BrilliancePeriodically grants Yanfei a Scarlet Seal. Increases the DMG of her Charged Attacks. The Brilliance effect stops when Yanfei leaves the field or falls in battle."
Proviso,1st Ascension Passive,"When Yanfei consumes Scarlet Seals by using a Charged Attack, each Scarlet Seal will increase Yanfei's Pyro DMG Bonus by 5%. This effect lasts for 6s. When a Charged Attack is used again during the effect's duration, it will dispel the previous effect."
Blazing Eye,4th Ascension Passive,"When Yanfei's Charged Attack deals a CRIT Hit to opponents, she will deal an additional instance of AoE Pyro DMG equal to 80% of her ATK. This DMG counts as Charged Attack DMG."
Encyclopedic Expertise,Utility Passive,Displays the location of nearby resources unique to Liyue on the mini-map.
